{
  "$schema": "https://json-schema.org/draft/2020-12/schema",
  "$id": "https://model-forge.local/architecture/schemas/t2s-summary.schema.json",
  "title": "T2s Phase Run Summary",
  "description": "The research lead's evaluative summary of a phase run (system_artifact_types.md): serves the lead's own later synthesis AND the user's 'Read more details' UI panel. Lead-authored only. Total serialized size must stay under 32768 bytes (runtime-enforced hard cap).",
  "type": "object",
  "additionalProperties": false,
  "required": ["summary_id", "phase", "headline", "evaluation_markdown", "created_at"],
  "properties": {
    "summary_id": {"type": "string", "minLength": 1},
    "phase": {"type": "string", "enum": ["P1", "P2", "P3", "P4", "P5"]},
    "headline": {"type": "string", "minLength": 1, "maxLength": 240},
    "evaluation_markdown": {"type": "string", "minLength": 1, "description": "Explain what was established, its support and decisive limitation, and what subsequent work may rely on. For a P5 revision, state substantive changes with review issue references, preserve unresolved criticism, and distinguish the reviewed draft from the lead-checked revision."},
    "method_scores": {
      "type": "array",
      "description": "Optional per-method scoring matrix (UI-facing only, mirrored from the decision record per D11).",
      "items": {
        "type": "object",
        "additionalProperties": false,
        "required": ["method_ref", "score", "rationale"],
        "properties": {
          "method_ref": {"type": "string"},
          "score": {"type": "number"},
          "rationale": {"type": "string", "maxLength": 600}
        }
      }
    },
    "open_items": {"type": "array", "items": {"type": "string"}},
    "created_at": {"type": "string", "format": "date-time"}
  }
}
